{
  "schema_version": 1,
  "benchmark_id": "P-10-vello-0.9-translucent-layers",
  "recorded_at_utc": "2026-08-12T19:41:25Z",
  "environment": {
    "os": "macOS",
    "os_version": "15.6.1",
    "architecture": "aarch64",
    "processor": "Apple M4",
    "memory_bytes": 17179869184,
    "display": null,
    "background_load_profile": "interactive-apps-open"
  },
  "workload": {
    "name": "vello-0.9 / translucent-layers",
    "scene": "tools/renderer-shootout/generated/translucent-layers",
    "resolution": [
      1280,
      720
    ],
    "duration_seconds": 0.09171570400000002,
    "notes": [
      "900 ordered translucent paths; blend and overdraw pressure",
      "Experimental architecture evidence; not a renderer selection.",
      "Frame samples include CPU encoding, GPU submission, and completion wait."
    ]
  },
  "samples": [
    {
      "name": "retained_prepare_time",
      "unit": "ms",
      "statistic": "single",
      "value": 0.17049999999999998
    },
    {
      "name": "frame_time",
      "unit": "ms",
      "statistic": "p50",
      "value": 1.485
    },
    {
      "name": "frame_time",
      "unit": "ms",
      "statistic": "p95",
      "value": 1.800667
    },
    {
      "name": "frame_time",
      "unit": "ms",
      "statistic": "p99",
      "value": 2.699458
    },
    {
      "name": "retained_geometry",
      "unit": "bytes",
      "statistic": "single",
      "value": 105334.0
    }
  ],
  "provenance": {
    "revision": "d47fd5bbf657+tree-eb0ec98aad942ad8",
    "dirty": true,
    "commands": [
      "cargo run --release -p realtime-manim-renderer-shootout -- --output benchmarks/renderer-shootout/2026-08-12-metal --width 1280 --height 720 --warmup 12 --iterations 60 --background-load interactive-apps-open"
    ],
    "artifacts": [
      "benchmarks/renderer-shootout/2026-08-12-metal/translucent-layers-vello.png",
      "benchmarks/renderer-shootout/2026-08-12-metal/report.json"
    ]
  }
}